[
  {
    "id": "mo-mark-twain-eleven-point",
    "name": "Eleven Point River Dispersed Primitive Camping - Mark Twain National Forest",
    "state": "Missouri",
    "county": "Oregon County / Shannon County",
    "coordinates": {
      "latitude": 36.8412,
      "longitude": -91.2814,
      "elevation_ft": 580
    },
    "management_agency": {
      "name": "U.S. Forest Service - Eleven Point Ranger District",
      "type": "USFS",
      "phone": "(417) 256-7101",
      "website": "https://www.fs.usda.gov/mtnf"
    },
    "rules_and_regulations": {
      "cost": "100% Free - No fees, no permits required for general forest dispersed camping",
      "stay_limit": "14 consecutive days max stay within 30-day period",
      "guidelines": "Dispersed primitive camping permitted throughout general national forest lands at least 100ft from roads, trails, and water bodies."
    },
    "waste_disposal_rules": {
      "poop_disposal": "Cathole method: dig 6-8 inches deep in organic soil, at least 200 feet from Eleven Point River and springs. Pack out toilet paper.",
      "trash_policy": "Strict Leave No Trace pack-it-in pack-it-out."
    },
    "campfire_rules": {
      "permitted": true,
      "firewood_policy": "Gather dead and downed wood only.",
      "safety_requirements": "Campfires in established rock fire rings only. Extinguish cold to touch.",
      "seasonal_fire_bans": "Obey Missouri Department of Conservation burn bans."
    },
    "access_and_road_conditions": {
      "road_type": "Unpaved gravel forest service roads (FS 3152 / FS 4112)",
      "road_conditions": "Winding gravel forest roads with small washboards and dips.",
      "vehicle_recommendation": "Normal low clearance front wheel drive car (accessible on main gravel forest roads in dry weather)",
      "scores": {
        "road_grade": 3,
        "road_terrain_difficulty": 4,
        "supply_run_pain": 4
      }
    },
    "nomad_connectivity_rating": {
      "overall_rating": "Moderate / High Point Dependent",
      "verizon_reliability": "2-3 bars 4G LTE on ridge turnouts; weak down near river bottom",
      "att_reliability": "2-3 bars 4G LTE",
      "tmobile_reliability": "1-2 bars 4G LTE",
      "terrain_obstruction_risk": "Moderate (Ozark bluff river valleys restrict cell signals)",
      "distance_from_tower_corridor_miles": 5.8,
      "cellular_internet_dependable": true
    },
    "amenities": [
      "Spring-fed River Access (Eleven Point River - filter required)",
      "Ozark Bluff Scenery",
      "Established Fire Rings",
      "Oak & Pine Shade"
    ],
    "location_scores": {
      "distance_to_groceries_score": 5,
      "distance_to_library_score": 5,
      "distance_to_gym_score": 4,
      "terrain_score": 8,
      "quietness_score": 9
    },
    "nearest_supply_towns": [
      {
        "town_name": "Alton / West Plains, MO",
        "distance_miles": 14.5,
        "services_available": [
          "Walmart Supercenter",
          "Gas Stations",
          "Pharmacy",
          "Public Library",
          "Ozarks Healthcare Hospital"
        ]
      }
    ],
    "seasonal_weather_effects": {
      "spring": "55-70°F, high spring river flow, blooming dogwoods, spring rainstorms.",
      "summer": "Hot and humid (85-92°F), spring-fed river float trips, high insect activity.",
      "fall": "Spectacular Ozark autumn foliage (55-70°F daytime, 40-50°F nights), ideal camping weather.",
      "winter": "Cool 35-50°F, freezing nights, quiet forest."
    },
    "dangers_and_hazards": [
      "Flash flooding along river drainages after heavy Ozark rain",
      "Venomous snakes: Copperheads active in warm months",
      "Ticks and chiggers in brush"
    ],
    "acoustic_environment": {
      "quietness_rating": "9/10 - River and forest quiet",
      "common_human_made_sounds": [
        "Occasional canoeist paddling on Eleven Point River",
        "High aircraft contrails"
      ]
    },
    "flora_and_fauna": {
      "common_plants_and_trees": [
        "Shortleaf Pine",
        "White Oak",
        "Flowering Dogwood",
        "Sycamore (Platanus occidentalis along river)"
      ],
      "common_animals": [
        "White-tailed Deer",
        "Wild Turkey",
        "Black Bear (re-establishing)",
        "Copperhead",
        "Ozark Hellbender (Cryptobranchus alleganiensis bishopi - endangered aquatic salamander)"
      ]
    },
    "human_demographics_and_culture": "Canoe floats / kayakers, Ozark Trail backpackers, trout anglers, and digital nomads.",
    "spiritual_and_folklore_data": {
      "nature_spirits_and_mythological_lore": "Osage indigenous traditions revere the crystal-clear karst springs (Greer Spring) and river bluffs of the Eleven Point basin as sacred life waters.",
      "energetic_and_spiritual_features": "Profound karst spring vitality, soothing river acoustics, peaceful Ozark hill energy."
    },
    "nearby_hiking_trails": [
      {
        "trail_name": "Ozark Trail (Eleven Point River Section)",
        "length_miles": 28.0,
        "difficulty": "Moderate",
        "features": "Scenic bluffs, spring branches, hardwood forests, river views"
      }
    ],
    "public_reviews_summary": "Beautiful free primitive camping along the National Wild & Scenic Eleven Point River. Clean sites and good cell service on higher ridge turnouts.",
    "other_data": "Bortle Class 2-3 night sky. Abundant firewood.",
    "last_updated": "2026-09-12"
  },
  {
    "id": "mo-paddy-creek-wilderness-mark-twain-nf",
    "name": "Paddy Creek Wilderness Dispersed Primitive Camping",
    "state": "Missouri",
    "county": "Texas County",
    "coordinates": {
      "latitude": 37.5812,
      "longitude": -92.0412,
      "elevation_ft": 1150
    },
    "management_agency": {
      "name": "US Forest Service - Mark Twain National Forest (Houston Ranger District)",
      "type": "USFS",
      "phone": "(417) 967-4194",
      "website": "https://www.fs.usda.gov/mtnf"
    },
    "rules_and_regulations": {
      "cost": "100% Free - USFS Wilderness Primitive Camping (zero fee)",
      "stay_limit": "14 consecutive days stay limit",
      "guidelines": "Dispersed wilderness camping permitted throughout Paddy Creek Wilderness. Camp 100ft minimum from trails and streams."
    },
    "waste_disposal_rules": {
      "poop_disposal": "Dig cat-hole 6 inches deep in soil 200 feet from Paddy Creek. Pack out all paper.",
      "trash_policy": "Strict Pack-In / Pack-Out."
    },
    "campfire_rules": {
      "permitted": true,
      "firewood_policy": "Dead and down oak wood gathering permitted on site.",
      "safety_requirements": "Campfires in established rock fire rings only. Fully douse with water before vacating.",
      "seasonal_fire_bans": "Fall dry leaf fire warnings observed."
    },
    "access_and_road_conditions": {
      "road_type": "Paved state highway to gravel Forest Service roads (FR 220)",
      "road_conditions": "Graded gravel access roads, flat trailhead parking.",
      "vehicle_recommendation": "Accessible by standard 2WD low clearance vehicles.",
      "scores": {
        "road_grade": 3,
        "road_terrain_difficulty": 3,
        "supply_run_pain": 4
      }
    },
    "nomad_connectivity_rating": {
      "overall_rating": "Fair to Moderate / Ozark Ridge Signal",
      "verizon_reliability": "2-3 bars 4G LTE on high forest ridges",
      "att_reliability": "2-3 bars 4G LTE",
      "tmobile_reliability": "1-2 bars 4G LTE",
      "terrain_obstruction_risk": "Moderate in deep Ozark stream hollows",
      "distance_from_tower_corridor_miles": 5.0,
      "cellular_internet_dependable": true
    },
    "amenities": [
      "Ozark Pine & Hardwood Ridge Campsites",
      "Paddy Creek Water Source (Filter mandatory)",
      "Bluff Overlook Views",
      "Stone Fire Rings"
    ],
    "location_scores": {
      "distance_to_groceries_score": 6,
      "distance_to_library_score": 6,
      "distance_to_gym_score": 5,
      "terrain_score": 8,
      "quietness_score": 9
    },
    "nearest_supply_towns": [
      {
        "town_name": "Houston, MO",
        "distance_miles": 14.0,
        "services_available": [
          "Town & Country Supermarket",
          "Gas Stations",
          "Texas County Library",
          "Hospital",
          "Restaurants"
        ]
      },
      {
        "town_name": "Rolla, MO",
        "distance_miles": 28.0,
        "services_available": [
          "Walmart Supercenter",
          "Kroger / ALDI",
          "Missouri S&T Metro",
          "24/7 Gyms"
        ]
      }
    ],
    "seasonal_weather_effects": {
      "spring": "52-70°F, blooming dogwood and redbuds, spring stream flows.",
      "summer": "78-92°F, warm Ozark summer weather, shaded oak forest canopy.",
      "fall": "52-72°F, spectacular Ozark hardwood autumn foliage.",
      "winter": "28-48°F, crisp clear winter air, light snowfall."
    },
    "dangers_and_hazards": [
      "Flash flooding in creek hollows during thunderstorms",
      "Ticks and chiggers in summer (use permethrin)",
      "Bluff cliff drop-offs"
    ],
    "acoustic_environment": {
      "quietness_rating": "9/10 - Creek water trickles and Ozark woodland birds",
      "common_human_made_sounds": [
        "None inside wilderness boundary"
      ]
    },
    "flora_and_fauna": {
      "common_plants_and_trees": [
        "Shortleaf Pine (Missouri's native pine)",
        "Post Oak",
        "Flowering Dogwood",
        "Wild Azalea"
      ],
      "common_animals": [
        "White-tailed Deer",
        "Wild Turkey",
        "Bobcat",
        "Pileated Woodpecker",
        "Smallmouth Bass"
      ]
    },
    "human_demographics_and_culture": "Osage ancestral lands, Ozark mountain locals, Missouri backpackers, nomads.",
    "spiritual_and_folklore_data": {
      "nature_spirits_and_mythological_lore": "Rich Ozark mountain folklore honoring the ancient pine hollows and crystal spring waters of Texas County.",